fingerprint,first_seen,peak_time,peak_score,time_to_peak_s,unique_subreddits,appearances
expectation vs reality,2025-10-01 23:42:16,2025-10-26 22:08:14,4890,2154358,6,46
this cat has better posture than me,2025-10-01 09:58:17,2025-10-21 05:58:01,4979,1713584,6,40
no one  absolutely no one ,2025-10-02 03:32:26,2025-10-26 15:55:03,4944,2118157,6,40
teacher  we will have a quiz,2025-10-01 05:51:06,2025-10-19 23:27:29,4956,1618583,6,39
who else remembers this ,2025-10-03 01:04:48,2025-10-15 15:31:31,4815,1088803,6,38
caption this,2025-09-30 18:11:57,2025-10-06 04:35:22,4879,469405,6,38
my starter pack for exams,2025-10-01 20:37:44,2025-10-05 23:22:17,4831,355473,6,34
when you finally finish the assignment,2025-10-03 04:17:15,2025-10-07 18:43:26,4975,397571,6,30
that moment when coffee kicks in,2025-10-01 22:48:52,2025-10-30 10:38:57,4687,2461805,6,29
pov  you open the oven and   ,2025-10-04 13:37:02,2025-10-15 17:34:39,4969,964657,6,26
expectation vs reality  ,2025-10-06 13:25:03,2025-10-24 15:26:59,4411,1562516,6,14
caption this  ,2025-10-02 19:10:09,2025-10-10 02:24:37,4911,630868,5,12
no one  absolutely no one   ,2025-10-02 06:28:12,2025-10-21 00:06:50,4704,1618718,5,8
when you finally finish the assignment  ,2025-10-10 00:59:37,2025-10-10 00:59:37,4767,0,4,7
this cat has better posture than me  ,2025-10-03 16:53:33,2025-10-10 18:03:45,4307,609012,5,7
who else remembers this   ,2025-10-02 00:46:30,2025-10-16 21:38:07,4953,1284697,5,7
this cat has better posture than me  new caption ,2025-10-06 01:24:40,2025-10-06 01:24:40,3987,0,3,7
pov  you open the oven and     ,2025-10-02 04:00:04,2025-10-22 10:16:27,4243,1750583,5,7
my starter pack for exams  ,2025-10-04 11:31:38,2025-10-19 17:21:14,2965,1316976,4,6
that moment when coffee kicks in  ,2025-10-03 11:01:43,2025-10-28 11:54:37,4790,2163174,5,6
no one  absolutely no one   new caption ,2025-10-03 02:52:25,2025-10-27 05:59:08,4137,2084803,3,5
pov  you open the oven and     new caption ,2025-10-03 12:22:32,2025-10-07 14:41:33,4894,353941,4,5
when u finally finish the assignment,2025-10-02 17:10:58,2025-10-02 17:10:58,4826,0,4,5
teacher  we will have a quiz  ,2025-10-08 01:39:48,2025-10-09 23:49:22,3628,166174,2,4
who else remembers this   new caption ,2025-10-06 00:09:30,2025-10-23 15:31:38,4895,1524128,3,4
pov  you open the oven     ,2025-10-01 04:35:18,2025-10-07 01:04:15,2849,505737,3,4
expectation vs reality  new caption ,2025-10-09 21:00:12,2025-10-09 21:00:12,4703,0,3,3
my starter pack for exams  new caption ,2025-10-04 13:25:26,2025-10-23 13:21:31,3842,1641365,2,2
caption this  new caption ,2025-10-01 21:09:12,2025-10-01 21:09:12,1808,0,2,2
no one  absolutely no one     new caption ,2025-10-22 16:36:53,2025-10-28 20:32:38,4835,532545,2,2
pov  you open the oven and       new caption ,2025-10-09 02:51:22,2025-10-30 12:33:08,3337,1849306,2,2
when you finally finish the assignment  new caption ,2025-10-08 20:15:52,2025-10-08 20:15:52,3313,0,1,2
that moment when coffee kicks in  new caption ,2025-10-11 16:26:00,2025-10-11 16:26:00,2233,0,2,2
expectation vs reality    new caption ,2025-10-11 08:38:17,2025-10-24 23:59:46,4941,1178489,2,2
that moment when coffee kicks in    new caption ,2025-10-06 21:43:28,2025-10-06 21:43:28,2378,0,1,1
when u finally finish the assignment  ,2025-10-15 15:39:52,2025-10-15 15:39:52,762,0,1,1
teacher  we will have a quiz  new caption ,2025-10-20 20:32:57,2025-10-20 20:32:57,2487,0,1,1
pov  you open the oven       ,2025-10-12 21:48:15,2025-10-12 21:48:15,3708,0,1,1
who else remembers this     new caption ,2025-10-15 20:20:18,2025-10-15 20:20:18,168,0,1,1
